Description,TimeOfDay,Description_clean
Walking through the endless vermilion torii gates of Fushimi Inari Shrine.,Morning,walking through the endless vermilion torii gates of fushimi inari shrine
White buildings with blue domes overlooking the calm Aegean Sea.,Afternoon,white buildings with blue domes overlooking the calm aegean sea
The ancient Incan citadel set high in the Andes Mountains.,Morning,the ancient incan citadel set high in the andes mountains
Elephants walking through the tall grass of the savanna.,Afternoon,elephants walking through the tall grass of the savanna
The bright neon lights and crowds of Times Square.,Evening,the bright neon lights and crowds of times square
Green aurora borealis dancing over a snowy landscape.,Evening,green aurora borealis dancing over a snowy landscape
"""wide landscape shot showing the ruins surrounded by the mountains for one of the newest seven wonders of the world""",Morning,wide landscape shot showing the ruins surrounded by the mountains for one of the newest seven wonders of the world
"""snowy lakeside village that brings inner peace to the visitor""",Afternoon,snowy lakeside village that brings inner peace to the visitor
"""one of the modern seven wonders of the world, Christ the Redeemer overlooking to the beaches and the city under bright sun",Afternoon,one of the modern seven wonders of the world christ the redeemer overlooking to the beaches and the city under bright sun
"""Tall Avatar-style sandstone pillars covered in mist, make you feel like in the movie""",Afternoon,tall avatarstyle sandstone pillars covered in mist make you feel like in the movie
"""lantern-lit city at night with warm colors""",Evening,lanternlit city at night with warm colors
"""Shibuya Crossing at night with neon light everywhere """,Evening,shibuya crossing at night with neon light everywhere
"""Calm countryside atmposphere where sheeps grazing peacefully in the large grassy field in the foreground while the abbey centered in the middle """,Evening,calm countryside atmposphere where sheeps grazing peacefully in the large grassy field in the foreground while the abbey centered in the middle
"""a dramatic mountain landscape with a narrow trail running along the ridgeline during a sunrise""",Morning,a dramatic mountain landscape with a narrow trail running along the ridgeline during a sunrise
""" valley with Staubbach waterfall, green fields, Swiss houses and mountains",Afternoon,valley with staubbach waterfall green fields swiss houses and mountains
""" valley with Staubbach waterfall, green fields, Swiss houses and mountains",Afternoon,valley with staubbach waterfall green fields swiss houses and mountains
"A clear aerial view of a Maldives island featuring a white sandy beach, turquoise water, palm trees, and a seaplane parked on the shore. This image represents the peaceful tropical beauty of the Maldives.",Afternoon,a clear aerial view of a maldives island featuring a white sandy beach turquoise water palm trees and a seaplane parked on the shore this image represents the peaceful tropical beauty of the maldives
"A stunning sunset view of the Maiden’s Tower in Istanbul, illuminated warmly as the city skyline glows behind it. The vibrant sky blends orange and blue, creating a magical atmosphere over the Bosphorus.",Evening,a stunning sunset view of the maiden’s tower in istanbul illuminated warmly as the city skyline glows behind it the vibrant sky blends orange and blue creating a magical atmosphere over the bosphorus
"Trekkers hiking through the rocky trails of the Everest region in the Himalayas, surrounded by dramatic mountain landscapes and clear blue skies. The snowy peaks create a breathtaking, adventurous atmosphere.",Morning,trekkers hiking through the rocky trails of the everest region in the himalayas surrounded by dramatic mountain landscapes and clear blue skies the snowy peaks create a breathtaking adventurous atmosphere
"A stunning alpine landscape in Switzerland with bright green hills, a peaceful lake, wooden cabins, and towering snow-covered peaks under a clear blue sky. A postcard-perfect mountain view.",Afternoon,a stunning alpine landscape in switzerland with bright green hills a peaceful lake wooden cabins and towering snowcovered peaks under a clear blue sky a postcardperfect mountain view
"A vibrant night scene in Kabukichō, Tokyo, filled with colorful neon lights, busy crosswalks, and lively crowds. The illuminated buildings highlight the energetic nightlife of Japan's capital.",Evening,a vibrant night scene in kabukichō tokyo filled with colorful neon lights busy crosswalks and lively crowds the illuminated buildings highlight the energetic nightlife of japans capital
"A peaceful desert highway in Texas leading toward rugged, sunlit mountains. The warm evening light casts dramatic shadows across the rocky landscape, capturing the quiet beauty of the American Southwest.",Evening,a peaceful desert highway in texas leading toward rugged sunlit mountains the warm evening light casts dramatic shadows across the rocky landscape capturing the quiet beauty of the american southwest
A breathtaking sunset scene at the Pyramids of Giza featuring camel riders crossing the desert as the warm sun casts dramatic shadows. The silhouettes of the ancient pyramids create a timeless and adventurous atmosphere.,Evening,a breathtaking sunset scene at the pyramids of giza featuring camel riders crossing the desert as the warm sun casts dramatic shadows the silhouettes of the ancient pyramids create a timeless and adventurous atmosphere
"A picturesque Parisian street leading to the Eiffel Tower at sunset, with warm light reflecting off historic buildings and cobblestone streets. The soft sky colors highlight the romantic charm of Paris.",Evening,a picturesque parisian street leading to the eiffel tower at sunset with warm light reflecting off historic buildings and cobblestone streets the soft sky colors highlight the romantic charm of paris
"A golden sunset at Ipanema Beach in Rio de Janeiro, with surfboards in the sand and people enjoying the lively beachfront. The iconic Dois Irmãos mountains create a perfect blend of nature, surf culture, and Brazilian energy.",Evening,a golden sunset at ipanema beach in rio de janeiro with surfboards in the sand and people enjoying the lively beachfront the iconic dois irmãos mountains create a perfect blend of nature surf culture and brazilian energy
A majestic view of the Great Wall of China winding across lush green mountains under a dramatic cloudy sky. The ancient stone towers and pathways highlight the vast scale and historical significance of this landmark.,Afternoon,a majestic view of the great wall of china winding across lush green mountains under a dramatic cloudy sky the ancient stone towers and pathways highlight the vast scale and historical significance of this landmark
Eiffel Tower in Paris during sunset with colorful sky,Evening,eiffel tower in paris during sunset with colorful sky
White houses and blue domes in Santorini on a bright day,Afternoon,white houses and blue domes in santorini on a bright day
Shibuya crossing in Tokyo full of people and bright neon lights,Evening,shibuya crossing in tokyo full of people and bright neon lights
Turquoise water and overwater bungalows in the Maldives,Afternoon,turquoise water and overwater bungalows in the maldives
The ancient rock-carved facade of Petra between high cliffs,Afternoon,the ancient rockcarved facade of petra between high cliffs
Times Square in New York with colorful billboards and crowds,Evening,times square in new york with colorful billboards and crowds
Snow-covered peaks of the Swiss Alps with a valley below,Afternoon,snowcovered peaks of the swiss alps with a valley below
Green rice terraces in Bali surrounded by tropical trees,Morning,green rice terraces in bali surrounded by tropical trees
The Great Pyramids of Giza under a clear blue sky,Afternoon,the great pyramids of giza under a clear blue sky
Hot air balloons flying over the rocky valleys of Cappadocia,Morning,hot air balloons flying over the rocky valleys of cappadocia
"A distant view of the Eiffel Tower with surrounding buildings. I chose this place because of its historic charm, iconic architecture, and relaxing atmosphere.",Evening,a distant view of the eiffel tower with surrounding buildings i chose this place because of its historic charm iconic architecture and relaxing atmosphere
A traditional Japanese house surrounded by colorful autumn trees. I chose this place because of its peaceful atmosphere and the beauty of Japanese architecture during the fall season.,Afternoon,a traditional japanese house surrounded by colorful autumn trees i chose this place because of its peaceful atmosphere and the beauty of japanese architecture during the fall season
"Fishing boats docked in a scenic harbor in Cape Town. I chose this place because its clear waters, vibrant harbor atmosphere, and sense of adventure make it an exciting travel destination.",Afternoon,fishing boats docked in a scenic harbor in cape town i chose this place because its clear waters vibrant harbor atmosphere and sense of adventure make it an exciting travel destination
"A young woman in traditional Peruvian clothes standing among purple spring flowers in Cusco. I chose this place because I’m curious to learn more about its rich history, culture, and beautiful traditional atmosphere.",Morning,a young woman in traditional peruvian clothes standing among purple spring flowers in cusco i chose this place because i’m curious to learn more about its rich history culture and beautiful traditional atmosphere
A woman sitting on a log near a snow-covered body of water in Canada. I chose this place for its serene winter landscape and the peaceful feeling of being close to nature.,Morning,a woman sitting on a log near a snowcovered body of water in canada i chose this place for its serene winter landscape and the peaceful feeling of being close to nature
Stands of the Spotify Camp Nou Stadium in Barcelona. I chose this place because of my passion for football and the iconic atmosphere of the stadium.,Afternoon,stands of the spotify camp nou stadium in barcelona i chose this place because of my passion for football and the iconic atmosphere of the stadium
A portrait of a kangaroo in an Australian animal park. I chose this place because I’m curious to explore Australia’s wildlife and natural environment.,Afternoon,a portrait of a kangaroo in an australian animal park i chose this place because i’m curious to explore australia’s wildlife and natural environment
A massive iceberg floating in Greenland’s icy waters. I chose this place for its breathtaking natural beauty and the sense of adventure in exploring remote polar landscapes.,Morning,a massive iceberg floating in greenland’s icy waters i chose this place for its breathtaking natural beauty and the sense of adventure in exploring remote polar landscapes
A red hammock tied between two trees in the Maldives. I chose this place for its relaxing atmosphere and the peaceful feeling of enjoying a calm morning by the beach.,Morning,a red hammock tied between two trees in the maldives i chose this place for its relaxing atmosphere and the peaceful feeling of enjoying a calm morning by the beach
A man riding a horse in traditional clothing in Tunisia. I chose this place for its rich cultural heritage and the charm of experiencing local traditions.,Afternoon,a man riding a horse in traditional clothing in tunisia i chose this place for its rich cultural heritage and the charm of experiencing local traditions
"Alhambra Palace, A historic Moorish palace in Granada famous for its intricate carvings, gardens, and Islamic architectural beauty.",Afternoon,alhambra palace a historic moorish palace in granada famous for its intricate carvings gardens and islamic architectural beauty
"Vatican City, St. Peter’s Basilica glowing beautifully over the river at sunset.",Evening,vatican city st peter’s basilica glowing beautifully over the river at sunset
"Dome of the Rock, A golden-domed Islamic shrine in Jerusalem known for its striking architecture and sacred significance.",Evening,dome of the rock a goldendomed islamic shrine in jerusalem known for its striking architecture and sacred significance
"Umayyad Mosque, A stunning view of the courtyard with golden mosaics and ancient architecture.",Morning,umayyad mosque a stunning view of the courtyard with golden mosaics and ancient architecture
"Giza Pyramids, Camels crossing the desert in front of the iconic Great Pyramid.",Afternoon,giza pyramids camels crossing the desert in front of the iconic great pyramid
"Santorini, White cliffside houses overlooking the blue sea with pink bougainvillea trees.",Morning,santorini white cliffside houses overlooking the blue sea with pink bougainvillea trees
"A traditional market in Fez, where colorful slippers and handmade crafts line the steps, showcasing the city’s rich heritage.",Afternoon,a traditional market in fez where colorful slippers and handmade crafts line the steps showcasing the city’s rich heritage
"The Australian Alps, known for their high peaks and snowy landscapes, offer some of the country’s highest and most scenic mountain views.",Afternoon,the australian alps known for their high peaks and snowy landscapes offer some of the country’s highest and most scenic mountain views
"Central London, known for its historic streets and iconic red double-decker buses, is one of the city’s most recognizable and vibrant areas.",Afternoon,central london known for its historic streets and iconic red doubledecker buses is one of the city’s most recognizable and vibrant areas
"The famous Berlin Cathedral, illuminated beautifully at night, reflected on the waters of the Spree River amid a calm and charming atmosphere.",Evening,the famous berlin cathedral illuminated beautifully at night reflected on the waters of the spree river amid a calm and charming atmosphere
This photo shows the Eiffel Tower on a morning. I chose this place because it is very famous and I want to visit Paris.,Morning,this photo shows the eiffel tower on a morning i chose this place because it is very famous and i want to visit paris
This photo shows the Grand Canyon during sunrise with beautiful colors on the rocks. I chose this place because it looks amazing and I want to visit it one day,Morning,this photo shows the grand canyon during sunrise with beautiful colors on the rocks i chose this place because it looks amazing and i want to visit it one day
"This photo shows the Swiss Alps with a snowy mountain, blue lakes, and green valleys. I chose this place because it looks peaceful and very beautiful.",Morning,this photo shows the swiss alps with a snowy mountain blue lakes and green valleys i chose this place because it looks peaceful and very beautiful
This photo shows the Statue of Liberty on a sunny day with a beautiful view of the city behind it. I chose this place because it is very famous and I want to visit New York one day.,Afternoon,this photo shows the statue of liberty on a sunny day with a beautiful view of the city behind it i chose this place because it is very famous and i want to visit new york one day
This photo shows beautiful overwater villas in the Maldives during sunset. I chose this place because it looks peaceful and perfect for relaxing,Evening,this photo shows beautiful overwater villas in the maldives during sunset i chose this place because it looks peaceful and perfect for relaxing
This photo shows Shibuya Crossing at night with many people and bright lights. I chose this place because it looks exciting and full of energy.,Evening,this photo shows shibuya crossing at night with many people and bright lights i chose this place because it looks exciting and full of energy
"This photo shows Oia in Santorini during sunset, with white houses and a beautiful sea view. I chose this place because it looks peaceful and very famous.",Evening,this photo shows oia in santorini during sunset with white houses and a beautiful sea view i chose this place because it looks peaceful and very famous
"This photo shows the Dome of the Rock covered in snow, with people playing outside. I chose this place because it is important and very beautiful, especially in the snow.",Afternoon,this photo shows the dome of the rock covered in snow with people playing outside i chose this place because it is important and very beautiful especially in the snow
This photo shows Tower Bridge in London at night with bright lights. I chose this place because it is a famous landmark and I want to visit London one day.,Evening,this photo shows tower bridge in london at night with bright lights i chose this place because it is a famous landmark and i want to visit london one day
"This image shows Stonehenge covered in snow. I chose this place because it is very old and mysterious, and I would like to see it in real life.",Morning,this image shows stonehenge covered in snow i chose this place because it is very old and mysterious and i would like to see it in real life
"Eiffel Tower in Paris at sunset, chosen because it's an iconic landmark and dream destination for many travelers.",Evening,eiffel tower in paris at sunset chosen because its an iconic landmark and dream destination for many travelers
"Amsterdam canals with bicycles and Dutch houses, chosen for its beautiful city architecture and peaceful waterways.",Afternoon,amsterdam canals with bicycles and dutch houses chosen for its beautiful city architecture and peaceful waterways
"Old Town Square in Prague at sunset, chosen for its magical medieval atmosphere and golden skyline.",Evening,old town square in prague at sunset chosen for its magical medieval atmosphere and golden skyline
"Alhambra in Granada, a historic Islamic palace chosen for its architecture and cultural importance.",Afternoon,alhambra in granada a historic islamic palace chosen for its architecture and cultural importance
"Lake Como overlooking the mountains, chosen for its peaceful water views and charming villages.",Afternoon,lake como overlooking the mountains chosen for its peaceful water views and charming villages
"Hallstatt village covered in snow, chosen for its fairy-tale beauty and winter charm.",Morning,hallstatt village covered in snow chosen for its fairytale beauty and winter charm
"""The Kaaba in Mecca, Saudi Arabia, the holiest site in Islam.""",Afternoon,the kaaba in mecca saudi arabia the holiest site in islam
"""The Dome of the Rock in Jerusalem, a historic Islamic shrine with a golden dome.""",Evening,the dome of the rock in jerusalem a historic islamic shrine with a golden dome
"""The blue-domed churches and white-washed buildings of Oia, Santorini, Greece, overlooking the sea.""",Evening,the bluedomed churches and whitewashed buildings of oia santorini greece overlooking the sea
"A traditional Japanese Torii gate and temple structure illuminated at dusk, suggesting a quiet, spiritual place.",Evening,a traditional japanese torii gate and temple structure illuminated at dusk suggesting a quiet spiritual place
"""The Eiffel Tower in Paris, France, an iconic landmark and symbol of French culture.""",Evening,the eiffel tower in paris france an iconic landmark and symbol of french culture
"The Taj Mahal in Agra, India, iconic white marble mausoleum and symbol of love.",Morning,the taj mahal in agra india iconic white marble mausoleum and symbol of love
"The Elizabeth Tower (Big Ben) in London, a famous historical clock tower.",Evening,the elizabeth tower big ben in london a famous historical clock tower
"""The Statue of Liberty in New York City, USA, a symbol of freedom and democracy.""",Evening,the statue of liberty in new york city usa a symbol of freedom and democracy
Al-Aqsa Mosque a sacred and historical Islamic site,Afternoon,alaqsa mosque a sacred and historical islamic site
Colosseum in Rome an ancient Roman amphitheater showcasing historical architecture,Evening,colosseum in rome an ancient roman amphitheater showcasing historical architecture
Seoul cityscape vibrant city with modern architecture,Evening,seoul cityscape vibrant city with modern architecture
Eiffel Tower in Paris an iconic landmark in France.,Afternoon,eiffel tower in paris an iconic landmark in france
Aurora Borealis in the Arctic Circle Northern Lights illuminating the night sky,Evening,aurora borealis in the arctic circle northern lights illuminating the night sky
Beach in Sidi Bou Said Tunisia white sands and blue sea with scenic views,Afternoon,beach in sidi bou said tunisia white sands and blue sea with scenic views
Santorini iconic white houses and blue domes on cliffs overlooking the sea,Afternoon,santorini iconic white houses and blue domes on cliffs overlooking the sea
Beach in Thailand with crystal clear water perfect for relaxation and leisure,Morning,beach in thailand with crystal clear water perfect for relaxation and leisure
Bioluminescent beach in the Maldives glowing waters creating a magical night scene,Evening,bioluminescent beach in the maldives glowing waters creating a magical night scene
Cologne Cathedral in Germany Gothic architecture with intricate details,Morning,cologne cathedral in germany gothic architecture with intricate details
"A candid scene of daily life in Bali during heavy rainfall, showing a person on a motorcycle in front of a traditional building with decorated roofs. The rain in the image indicates that it's summer in Bali because it rains there during the summer. I chose Bali to experience its vibrant culture, tropical weather, and authentic local lifestyle.",Afternoon,a candid scene of daily life in bali during heavy rainfall showing a person on a motorcycle in front of a traditional building with decorated roofs the rain in the image indicates that its summer in bali because it rains there during the summer i chose bali to experience its vibrant culture tropical weather and authentic local lifestyle
"A stunning view of Iceland's dramatic coastline: black sand beaches, powerful ocean waves crashing against the rocky cliffs, and the aurora borealis glowing in the sky. When you see the aurora like that, it's definitely Fall the best time to catch this phenomenon. I picked Iceland for its weird volcanic landscapes, the raw untouched nature that's unlike anywhere else, and of course, the magical aurora borealis.",Evening,a stunning view of icelands dramatic coastline black sand beaches powerful ocean waves crashing against the rocky cliffs and the aurora borealis glowing in the sky when you see the aurora like that its definitely fall the best time to catch this phenomenon i picked iceland for its weird volcanic landscapes the raw untouched nature thats unlike anywhere else and of course the magical aurora borealis
A stunning view of Istanbul's iconic Maiden's Tower (Kız Kulesi) standing in the brilliant blue waters of the Bosphorus strait under clear skies. I chose Istanbul to experience its unique blend of European and Asian cultures and explore its rich Ottoman heritage.,Afternoon,a stunning view of istanbuls iconic maidens tower kız kulesi standing in the brilliant blue waters of the bosphorus strait under clear skies i chose istanbul to experience its unique blend of european and asian cultures and explore its rich ottoman heritage
"A stunning sunset view of Kyoto's traditional pagoda temple illuminated against a colorful sky, surrounded by historic Japanese architecture. I chose Kyoto to experience traditional Japanese culture, visit ancient temples, and witness the beauty of cherry blossoms.",Evening,a stunning sunset view of kyotos traditional pagoda temple illuminated against a colorful sky surrounded by historic japanese architecture i chose kyoto to experience traditional japanese culture visit ancient temples and witness the beauty of cherry blossoms
An aerial view of a luxurious Maldives resort with overwater bungalows extending into crystal-clear turquoise lagoons and pristine white sandy beaches. I chose the Maldives for its paradise-like tropical islands and perfect relaxation in stunning natural beauty.,Morning,an aerial view of a luxurious maldives resort with overwater bungalows extending into crystalclear turquoise lagoons and pristine white sandy beaches i chose the maldives for its paradiselike tropical islands and perfect relaxation in stunning natural beauty
"The iconic Koutoubia Mosque minaret tower rising above traditional Moroccan gardens with palm trees and lush vegetation. I chose Marrakech to experience the vibrant souks, stunning Islamic architecture, and rich North African culture.",Afternoon,the iconic koutoubia mosque minaret tower rising above traditional moroccan gardens with palm trees and lush vegetation i chose marrakech to experience the vibrant souks stunning islamic architecture and rich north african culture
"The magnificent Treasury (Al-Khazneh) carved into rose-red sandstone cliffs in the ancient city of Petra, with traditional horse carriages in front. I chose Petra to explore this UNESCO World Heritage site and witness the incredible Nabataean architecture carved into rock over 2,000 years ago.",Morning,the magnificent treasury alkhazneh carved into rosered sandstone cliffs in the ancient city of petra with traditional horse carriages in front i chose petra to explore this unesco world heritage site and witness the incredible nabataean architecture carved into rock over years ago
