Description,TimeOfDay,Description_clean
"A beautiful evening view of the Ortak?y Mosque glowing with warm lights beside the Bosphorus Bridge in Istanbul. I chose this place because it perfectly blends history, culture, and modern city life.",Evening,a beautiful evening view of the ortaky mosque glowing with warm lights beside the bosphorus bridge in istanbul i chose this place because it perfectly blends history culture and modern city life
"A stunning tropical view of Maldives with overwater bungalows, crystal-clear turquoise water, and palm trees under a bright sunny sky. I chose this place because it represents the perfect peaceful island escape.",Afternoon,a stunning tropical view of maldives with overwater bungalows crystalclear turquoise water and palm trees under a bright sunny sky i chose this place because it represents the perfect peaceful island escape
"A stunning view of the Pyramids of Giza during golden hour, with a camel rider crossing the desert. I chose this place because it’s one of the most iconic historical wonders in the world and represents ancient Egyptian civilization.",Evening,a stunning view of the pyramids of giza during golden hour with a camel rider crossing the desert i chose this place because it’s one of the most iconic historical wonders in the world and represents ancient egyptian civilization
"A stunning sunset view of Burj Khalifa rising above the glowing cityscape of Dubai. I chose this place because it represents modern architecture, luxury, and one of the most iconic skylines in the world.",Evening,a stunning sunset view of burj khalifa rising above the glowing cityscape of dubai i chose this place because it represents modern architecture luxury and one of the most iconic skylines in the world
"Beautiful Istanbul near Hagia Sophia, chosen because I love exploring historical landmarks",Morning,beautiful istanbul near hagia sophia chosen because i love exploring historical landmarks
"The pyramids in Egypt are an incredible architectural masterpiece, and I chose this place because I would love to see it in real life.",Afternoon,the pyramids in egypt are an incredible architectural masterpiece and i chose this place because i would love to see it in real life
"Al-Andalus is a place with a rich and beautiful history for Muslims, which is why I chose it.",Evening,alandalus is a place with a rich and beautiful history for muslims which is why i chose it
"Al-Aqsa Mosque in Jerusalem is a sacred place, and I chose it because I truly wish to visit it one day and pray there.",Afternoon,alaqsa mosque in jerusalem is a sacred place and i chose it because i truly wish to visit it one day and pray there
"The Eiffel Tower truly captures my attention, which is why I chose this destination.",Afternoon,the eiffel tower truly captures my attention which is why i chose this destination
"Dubai showcases the beauty of modern architectural design, which is why I chose this destination.",Afternoon,dubai showcases the beauty of modern architectural design which is why i chose this destination
"I chose this place because I would love to experience the activities in Thailand, especially riding a boat.",Morning,i chose this place because i would love to experience the activities in thailand especially riding a boat
I chose Greece because I would love to explore its historical landmarks and enjoy its stunning natural scenery.,Morning,i chose greece because i would love to explore its historical landmarks and enjoy its stunning natural scenery
"I chose Japan because it has been a dream of mine since childhood, and I wish to visit it to see its traditional homes.",Morning,i chose japan because it has been a dream of mine since childhood and i wish to visit it to see its traditional homes
"This iconic view features Mount Fuji with its snow-capped peak and the Chureito Pagoda, framed by vibrant pink cherry blossoms. I choose it because of quintessential, globally recognized symbol of Japanese natural beauty and culture, especially during the spring season.",Morning,this iconic view features mount fuji with its snowcapped peak and the chureito pagoda framed by vibrant pink cherry blossoms i choose it because of quintessential globally recognized symbol of japanese natural beauty and culture especially during the spring season
"This is a picture of a traditional Korean pavilion/pagoda in a historical park, framed by brilliant red and orange autumn maple leaves. It is chosen for its breathtaking capture of traditional Asian architecture amidst the rich colors of the fall season.",Afternoon,this is a picture of a traditional korean pavilionpagoda in a historical park framed by brilliant red and orange autumn maple leaves it is chosen for its breathtaking capture of traditional asian architecture amidst the rich colors of the fall season
This image shows a stunning evening view of Paris with the Eiffel Tower brightly illuminated beside the Seine River. The city lights and the colorful sky create a romantic and vibrant atmosphere. I chose this place because Paris is one of the most iconic travel destinations in the world and a city I’ve always wanted to explore.,Evening,this image shows a stunning evening view of paris with the eiffel tower brightly illuminated beside the seine river the city lights and the colorful sky create a romantic and vibrant atmosphere i chose this place because paris is one of the most iconic travel destinations in the world and a city i’ve always wanted to explore
"This is an aerial, daytime view of the Houses of Parliament and the Elizabeth Tower (Big Ben) along the River Thames in London, showcasing the full complex and the surrounding urban area. It is chosen as a definitive symbol of British democracy, history, and architectural grandeur in bright daylight.",Afternoon,this is an aerial daytime view of the houses of parliament and the elizabeth tower big ben along the river thames in london showcasing the full complex and the surrounding urban area it is chosen as a definitive symbol of british democracy history and architectural grandeur in bright daylight
"This is a picture of the Pyramids of Giza near Cairo. The photo captures the scale and ancient stone construction of the pyramid(s) against a clear blue sky. In the foreground, there are figures on camels, indicating a typical desert activity and providing a sense of scale. I chose this place because it is an unparalleled symbol of ancient civilization, engineering, and history, instantly recognizable worldwide.",Afternoon,this is a picture of the pyramids of giza near cairo the photo captures the scale and ancient stone construction of the pyramids against a clear blue sky in the foreground there are figures on camels indicating a typical desert activity and providing a sense of scale i chose this place because it is an unparalleled symbol of ancient civilization engineering and history instantly recognizable worldwide
"This is a stunning aerial or high-vantage-point photo of the Manhattan skyline in New York City at sunset. The dense grid of skyscrapers fills the frame, with the sunlight bursting through clouds on the right, casting a warm, golden glow on the buildings. The Empire State Building is clearly visible in the center. I chose this place because it represents the raw energy and beautiful density of one of the world's most recognizable cities, captured during a time of day that maximizes visual drama.",Evening,this is a stunning aerial or highvantagepoint photo of the manhattan skyline in new york city at sunset the dense grid of skyscrapers fills the frame with the sunlight bursting through clouds on the right casting a warm golden glow on the buildings the empire state building is clearly visible in the center i chose this place because it represents the raw energy and beautiful density of one of the worlds most recognizable cities captured during a time of day that maximizes visual drama
"This is a picture of the Great Wall of China, specifically showing its winding path along the mountainous ridges. The foreground features a well-preserved watchtower, with the wall extending far into the distance, connecting other towers on distant peaks. The wall is surrounded by thick, vibrant green foliage. I chose this place because it is one of the world's most impressive feats of human engineering and a profound symbol of Chinese history and culture.",Morning,this is a picture of the great wall of china specifically showing its winding path along the mountainous ridges the foreground features a wellpreserved watchtower with the wall extending far into the distance connecting other towers on distant peaks the wall is surrounded by thick vibrant green foliage i chose this place because it is one of the worlds most impressive feats of human engineering and a profound symbol of chinese history and culture
"This is a wide-angle photograph of the Prophet's Mosque (Al-Masjid an-Nabawi) in Medina, Saudi Arabia, captured at sunset, highlighting the many tall minarets and vast roof with its signature domes. I choose it for its immense spiritual significance as one of the holiest sites in Islam and its unique, tranquil architectural beauty.",Afternoon,this is a wideangle photograph of the prophets mosque almasjid annabawi in medina saudi arabia captured at sunset highlighting the many tall minarets and vast roof with its signature domes i choose it for its immense spiritual significance as one of the holiest sites in islam and its unique tranquil architectural beauty
"The image captures a vibrant red mountain train climbing a steep, lush green slope with massive, snow-capped mountains in the background.I chose this place because it perfectly encapsulates the stunning beauty and dramatic scale of the Swiss Alps, combining technological marvel with natural splendor.",Morning,the image captures a vibrant red mountain train climbing a steep lush green slope with massive snowcapped mountains in the backgroundi chose this place because it perfectly encapsulates the stunning beauty and dramatic scale of the swiss alps combining technological marvel with natural splendor
"This is a picture of the Süleymaniye Mosque in Istanbul, Turkey, captured during the day.I chose this place because it showcases the immense historical architecture and the bustling, colorful environment of Istanbul.",Afternoon,this is a picture of the süleymaniye mosque in istanbul turkey captured during the dayi chose this place because it showcases the immense historical architecture and the bustling colorful environment of istanbul
"""A cliffside view of Kelingking Beach in Nusa Penida, Bali. I chose it for the relaxing, amazing view and the peaceful feeling of looking over the bright blue water.""",Afternoon,a cliffside view of kelingking beach in nusa penida bali i chose it for the relaxing amazing view and the peaceful feeling of looking over the bright blue water
"""Evening view of the Colosseum in Rome, glowing with lights. I chose it because it’s a famous place I’ve always wanted to see, and it makes me curious about the stories and history inside its walls.""",Evening,evening view of the colosseum in rome glowing with lights i chose it because it’s a famous place i’ve always wanted to see and it makes me curious about the stories and history inside its walls
"""Morning view of the Maldives with a calm ocean and soft sunrise clouds. I chose it for the peaceful, very relaxing scene that simply makes me happy.""",Morning,morning view of the maldives with a calm ocean and soft sunrise clouds i chose it for the peaceful very relaxing scene that simply makes me happy
"""Rain falling over the Kaaba in Mecca during the evening. I chose it for its peaceful beauty and the warm, happy feeling it gives me inside.""",Evening,rain falling over the kaaba in mecca during the evening i chose it for its peaceful beauty and the warm happy feeling it gives me inside
"""A beautiful view of Niagara Falls in Canada with the water rushing down and touches of orange fall trees around it. I chose it because I visited before, and the magical, relaxing scene stayed with me.""",Afternoon,a beautiful view of niagara falls in canada with the water rushing down and touches of orange fall trees around it i chose it because i visited before and the magical relaxing scene stayed with me
"""Sunset view of the Pyramids of Giza with a warm golden sky. I chose it because seeing one of the world’s greatest ancient wonders at sunset feels unforgettable.""",Evening,sunset view of the pyramids of giza with a warm golden sky i chose it because seeing one of the world’s greatest ancient wonders at sunset feels unforgettable
"""Snowy Zermatt with the Matterhorn towering above. I chose it for the fun of skiing, the amazing view of the Alps, and the stunning winter scenery.""",Afternoon,snowy zermatt with the matterhorn towering above i chose it for the fun of skiing the amazing view of the alps and the stunning winter scenery
"""Hot-air balloons floating over Cappadocia at sunrise. I chose it for the unique adventure experience and the magical morning landscape.""",Morning,hotair balloons floating over cappadocia at sunrise i chose it for the unique adventure experience and the magical morning landscape
"""Rainy fall scene in Central Park with autumn trees while biking. I chose it because the fall colors and rainy atmosphere feel peaceful and nostalgic.""",Afternoon,rainy fall scene in central park with autumn trees while biking i chose it because the fall colors and rainy atmosphere feel peaceful and nostalgic
"""Skydiving over Palm Jumeirah in Dubai. I chose it because the aerial view and adrenaline of jumping above the iconic island feel unforgettable.""",Afternoon,skydiving over palm jumeirah in dubai i chose it because the aerial view and adrenaline of jumping above the iconic island feel unforgettable
"A view of Moscow City’s skyscrapers during winter, showing modern towers surrounded by snow and cold atmosphere.",Evening,a view of moscow city’s skyscrapers during winter showing modern towers surrounded by snow and cold atmosphere
"A classic Amsterdam canal view with bicycles and historic buildings, chosen for its peaceful European charm.",Afternoon,a classic amsterdam canal view with bicycles and historic buildings chosen for its peaceful european charm
"A beautiful view of Barcelona’s coastline with the city and beach atmosphere, chosen for its lively Mediterranean vibe.",Afternoon,a beautiful view of barcelona’s coastline with the city and beach atmosphere chosen for its lively mediterranean vibe
"A scenic view of Istanbul with historic architecture and the Bosphorus, chosen for its rich cultural atmosphere.",Evening,a scenic view of istanbul with historic architecture and the bosphorus chosen for its rich cultural atmosphere
"A vibrant cityscape of Seoul with tall modern buildings and colorful lights, chosen for its energetic urban atmosphere.",Evening,a vibrant cityscape of seoul with tall modern buildings and colorful lights chosen for its energetic urban atmosphere
"A stunning view of Norway’s mountains and icy waters, chosen for its peaceful and dramatic natural beauty.",Morning,a stunning view of norway’s mountains and icy waters chosen for its peaceful and dramatic natural beauty
"The famous Fushimi Inari Shrine with its iconic red torii gates, chosen for its cultural and spiritual significance.",Morning,the famous fushimi inari shrine with its iconic red torii gates chosen for its cultural and spiritual significance
"A dramatic mountainous landscape in Dagestan with steep cliffs and greenery, chosen for its breathtaking natural scenery.",Afternoon,a dramatic mountainous landscape in dagestan with steep cliffs and greenery chosen for its breathtaking natural scenery
"A vast icy landscape of Greenland with glaciers and snow, chosen for its serene and remote arctic beauty.",Morning,a vast icy landscape of greenland with glaciers and snow chosen for its serene and remote arctic beauty
"A rugged mountainous landscape in Afghanistan, chosen for its dramatic terrain and natural beauty.",Afternoon,a rugged mountainous landscape in afghanistan chosen for its dramatic terrain and natural beauty
White-sand tropical beach bordered by rainforest and the Great Barrier Reef.,Evening,whitesand tropical beach bordered by rainforest and the great barrier reef
Dramatic canyon view with a winding river and glowing cliffs.,Morning,dramatic canyon view with a winding river and glowing cliffs
Classic Roman rooftops and domes.,Afternoon,classic roman rooftops and domes
Ha Long Bay cliffs and calm water during sunset.,Morning,ha long bay cliffs and calm water during sunset
Green alpine fields and Dolomites mountains.,Morning,green alpine fields and dolomites mountains
Overwater villas and crystal-clear lagoon.,Morning,overwater villas and crystalclear lagoon
Dome of the Rock under clear blue sky.,Morning,dome of the rock under clear blue sky
"Alhambra Palace, A photo of the Court of the Lions, highlighting the detailed carvings on the marble pillars. I chose this place because its unique craftsmanship and historical atmosphere bring back nostalgic memories from my visit.",Afternoon,alhambra palace a photo of the court of the lions highlighting the detailed carvings on the marble pillars i chose this place because its unique craftsmanship and historical atmosphere bring back nostalgic memories from my visit
"Lake Como, A peaceful lakeside view with colorful flowers and classic buildings along the water. I chose this place because its calm atmosphere and natural beauty makes it a perfect getaway",Afternoon,lake como a peaceful lakeside view with colorful flowers and classic buildings along the water i chose this place because its calm atmosphere and natural beauty makes it a perfect getaway
"Jungfraujoch (Swiss Alps), A breathtaking view of snow-covered mountains under soft morning light. I chose this place because its majestic alpine scenery makes it a fascinating place to experience.",Morning,jungfraujoch swiss alps a breathtaking view of snowcovered mountains under soft morning light i chose this place because its majestic alpine scenery makes it a fascinating place to experience
"Colosseum, An early-morning view of the Roman Colosseum with some clouds in the sky, highlighting its ancient architecture. I chose this place because its deep history and timeless design is fascinating.",Morning,colosseum an earlymorning view of the roman colosseum with some clouds in the sky highlighting its ancient architecture i chose this place because its deep history and timeless design is fascinating
"Mecca, A view of the Kaaba at night. I chose this place because it is the holiest site in Islam.",Evening,mecca a view of the kaaba at night i chose this place because it is the holiest site in islam
"Antarctica, A wide icy landscape showing snow and glacier terrain. I chose this place because of its unique frozen beauty and the challenge of exploring one of the most extreme places on Earth.",Afternoon,antarctica a wide icy landscape showing snow and glacier terrain i chose this place because of its unique frozen beauty and the challenge of exploring one of the most extreme places on earth
"Maldives, A golden afternoon on a sunny beach with clear water and vacation huts. I chose this place for its relaxing tropical beauty.",Afternoon,maldives a golden afternoon on a sunny beach with clear water and vacation huts i chose this place for its relaxing tropical beauty
"Great Wall of China, A breathtaking view of the Great Wall of China snaking over mountains. I chose this place because it symbolizes ancient history and architectural marvels.",Afternoon,great wall of china a breathtaking view of the great wall of china snaking over mountains i chose this place because it symbolizes ancient history and architectural marvels
A sacred city for Muslims with great historical and cultural importance. I want to visit it to experience its spiritual atmosphere and rich history.,Afternoon,a sacred city for muslims with great historical and cultural importance i want to visit it to experience its spiritual atmosphere and rich history
A scenic city on the Black Sea coast with green hills and historic landmarks. I want to visit it to enjoy its natural beauty and explore its culture.,Afternoon,a scenic city on the black sea coast with green hills and historic landmarks i want to visit it to enjoy its natural beauty and explore its culture
"Disneyland is a magical theme park full of fun and excitement. I want to visit it to experience the rides, shows, and joyful atmosphere.",Evening,disneyland is a magical theme park full of fun and excitement i want to visit it to experience the rides shows and joyful atmosphere
"Rovaniemi is a magical Arctic?Circle city in Finnish Lapland, full of snowy landscapes, Northern Lights, and winter wonderland charm. I want to visit it to enjoy its unique Arctic nature, experience the snow and the lights, and live a dream of a fairy?tale winter.",Evening,rovaniemi is a magical arcticcircle city in finnish lapland full of snowy landscapes northern lights and winter wonderland charm i want to visit it to enjoy its unique arctic nature experience the snow and the lights and live a dream of a fairytale winter
Burj?Khalifa — the tallest building in the world — a symbol of modern engineering and dream architecture. I want to visit it to see the skyline from above and admire its grandeur,Evening,burjkhalifa — the tallest building in the world — a symbol of modern engineering and dream architecture i want to visit it to see the skyline from above and admire its grandeur
"The Maldives — a tropical paradise of crystal?clear waters and white sandy beaches, perfect for relaxation and island?life escape. I want to visit it to enjoy its serene nature, warm seas, and peaceful island ambiance.",Morning,the maldives — a tropical paradise of crystalclear waters and white sandy beaches perfect for relaxation and islandlife escape i want to visit it to enjoy its serene nature warm seas and peaceful island ambiance
"Venice is a magical city built on water, with charming canals and gondola rides; I want to visit it to ride a gondola, enjoy the canals and feel the unique romantic atmosphere.",Afternoon,venice is a magical city built on water with charming canals and gondola rides i want to visit it to ride a gondola enjoy the canals and feel the unique romantic atmosphere
Twin Lagoon in Coron is a hidden tropical paradise with crystal?clear turquoise water surrounded by dramatic limestone cliffs — I want to visit to swim between two connected lagoons and enjoy its natural beauty.,Afternoon,twin lagoon in coron is a hidden tropical paradise with crystalclear turquoise water surrounded by dramatic limestone cliffs — i want to visit to swim between two connected lagoons and enjoy its natural beauty
"Machu?Picchu — an ancient Inca mountain city perched high in the Andes; I want to hike there to explore the ruins, enjoy breathtaking mountain views and experience ancient history.",Afternoon,machupicchu — an ancient inca mountain city perched high in the andes i want to hike there to explore the ruins enjoy breathtaking mountain views and experience ancient history
"A clear and bright picture of the Dome of the Rock that we long for, surrounded by historic buildings and ancient stone walls.",Morning,a clear and bright picture of the dome of the rock that we long for surrounded by historic buildings and ancient stone walls
"A beautiful sunset view of the Great Pyramids of Giza, with warm golden sky colors shining over the desert.",Morning,a beautiful sunset view of the great pyramids of giza with warm golden sky colors shining over the desert
"A powerful waterfall with bright blue water crashing down, surrounded by clouds and mist.",Afternoon,a powerful waterfall with bright blue water crashing down surrounded by clouds and mist
"A night view of Shanghai’s skyline with colorful lights, featuring the bright pink Oriental Pearl Tower beside modern skyscrapers.",Evening,a night view of shanghai’s skyline with colorful lights featuring the bright pink oriental pearl tower beside modern skyscrapers
A bright daytime photo of the Leaning Tower of Pisa with people walking around the green lawn under a partly cloudy sky.,Afternoon,a bright daytime photo of the leaning tower of pisa with people walking around the green lawn under a partly cloudy sky
"A sunny photo of the ancient Petra building carved into the rock, with people walking in front of it under a deep blue sky.",Afternoon,a sunny photo of the ancient petra building carved into the rock with people walking in front of it under a deep blue sky
A large crowd of worshippers gathered around the Kaaba during prayer inside the Grand Mosque.,Evening,a large crowd of worshippers gathered around the kaaba during prayer inside the grand mosque
"A snowy winter scene of the Eiffel Tower with people walking toward it, surrounded by bare trees and a white walkway.",Afternoon,a snowy winter scene of the eiffel tower with people walking toward it surrounded by bare trees and a white walkway
"An aerial view of Barcelona with the Sagrada Família in the center, surrounded by long straight streets and warm sunset light.",Evening,an aerial view of barcelona with the sagrada família in the center surrounded by long straight streets and warm sunset light
"A charming street view leading to the historic Galata Tower, with old buildings, warm sunlight, and a cobblestone road.",Afternoon,a charming street view leading to the historic galata tower with old buildings warm sunlight and a cobblestone road
