Description,TimeOfDay,Description_clean
"""A clear view of the Kaaba in Masjid al-Haram, surrounded by worshippers in prayer. I chose this destination because it is a deeply sacred religious site and visiting it has always been one of my biggest dreams.""",Afternoon,a clear view of the kaaba in masjid alharam surrounded by worshippers in prayer i chose this destination because it is a deeply sacred religious site and visiting it has always been one of my biggest dreams
"""The Dome of the Rock, an iconic Islamic shrine in Jerusalem, is famous for its golden dome and intricate blue tiles. I chose it because of its spiritual importance, rich history, and architectural beauty.""",Afternoon,the dome of the rock an iconic islamic shrine in jerusalem is famous for its golden dome and intricate blue tiles i chose it because of its spiritual importance rich history and architectural beauty
A peaceful nature view with green valleys and mountains,Afternoon,a peaceful nature view with green valleys and mountains
"I chose Dome of the Rock because it is holy and in my heart. I feel natural love and longing to visit it, even though occupation stops us.",Morning,i chose dome of the rock because it is holy and in my heart i feel natural love and longing to visit it even though occupation stops us
I chose the Eiffel Tower because it’s iconic and full of charm. The lights at night make me feel excited to explore.,Evening,i chose the eiffel tower because it’s iconic and full of charm the lights at night make me feel excited to explore
"I chose Cappadocia because the hot air balloons at sunrise look magical. I dream of being there, feeling free in the sky.",Morning,i chose cappadocia because the hot air balloons at sunrise look magical i dream of being there feeling free in the sky
"I chose Sydney because it feels alive and full of energy. The mix of water, buildings, and landmarks makes me want to discover more.",Afternoon,i chose sydney because it feels alive and full of energy the mix of water buildings and landmarks makes me want to discover more
I chose Verona because it feels full of history and soul. The river and sunset make me imagine quiet walks and old stories.,Evening,i chose verona because it feels full of history and soul the river and sunset make me imagine quiet walks and old stories
I chose Dubai Miracle Garden because it looks like a fairytale. The flower houses and colors are creative and peaceful.,Afternoon,i chose dubai miracle garden because it looks like a fairytale the flower houses and colors are creative and peaceful
I chose the Maldives because the sea and wooden path make me feel calm. It looks like the perfect escape to rest and breathe.,Afternoon,i chose the maldives because the sea and wooden path make me feel calm it looks like the perfect escape to rest and breathe
I chose Hallstatt because it looks peaceful and quiet. The lake and mountains make me feel like I’m in a storybook.,Morning,i chose hallstatt because it looks peaceful and quiet the lake and mountains make me feel like i’m in a storybook
I chose Peterhof Palace because it looks royal and full of history. The fountains and gold statues make me feel amazed.,Afternoon,i chose peterhof palace because it looks royal and full of history the fountains and gold statues make me feel amazed
I chose the Louvre Museum because it mixes history and art. The sunset and quiet view make me feel calm and inspired.,Evening,i chose the louvre museum because it mixes history and art the sunset and quiet view make me feel calm and inspired
"Eiffel tower:One of the most famous landmarks in the world.This place represents beauty, art, and romance, and itÕs a symbol of Paris. Its unique design and stunning views make it a dream destination for many people.",Afternoon,eiffel towerone of the most famous landmarks in the worldthis place represents beauty art and romance and itõs a symbol of paris its unique design and stunning views make it a dream destination for many people
The Maldives is a peaceful tropical paradise with clear blue water and white sandy beaches,Evening,the maldives is a peaceful tropical paradise with clear blue water and white sandy beaches
Kaaba:The sacred cube-shaped building in Makkah that Muslims face during prayers.,Afternoon,kaabathe sacred cubeshaped building in makkah that muslims face during prayers
Mount Fuji: Iconic volcanic mountain with popular hiking trails to the summit.,Morning,mount fuji iconic volcanic mountain with popular hiking trails to the summit
Niagara Falls is a famous group of massive waterfalls known for its breathtaking beauty and powerful flow,Afternoon,niagara falls is a famous group of massive waterfalls known for its breathtaking beauty and powerful flow
"The Gobi Desert: is a vast, arid landscape , known for its sand dunes, rocky terrain, and extreme temperatures.",Evening,the gobi desert is a vast arid landscape known for its sand dunes rocky terrain and extreme temperatures
"The Pyramids of Egypt: are ancient monumental tombs in Giza, built as grand burial sites for pharaohs, showcasing incredible architectural skill.",Afternoon,the pyramids of egypt are ancient monumental tombs in giza built as grand burial sites for pharaohs showcasing incredible architectural skill
"Jaffa :is an ancient port city known for its historic streets, vibrant markets, and beautiful views of the Mediterranean Sea.",Evening,jaffa is an ancient port city known for its historic streets vibrant markets and beautiful views of the mediterranean sea
"Lapland is a snowy wonderland in the Arctic, famous for the northern lights, reindeer rides, and vast winter landscapes.",Evening,lapland is a snowy wonderland in the arctic famous for the northern lights reindeer rides and vast winter landscapes
"The Black Sand Beach: is a striking shoreline with black volcanic sand, dramatic basalt columns, and powerful Atlantic waves.",Morning,the black sand beach is a striking shoreline with black volcanic sand dramatic basalt columns and powerful atlantic waves
"The holiest place in Islam, chosen because it feels peaceful and meaningful to visit",Afternoon,the holiest place in islam chosen because it feels peaceful and meaningful to visit
"The second holiest place in Islam, chosen for its strong spiritual atmosphere and importance",Afternoon,the second holiest place in islam chosen for its strong spiritual atmosphere and importance
"A famous Islamic landmark with a golden dome, chosen for its deep history and religious value.",Evening,a famous islamic landmark with a golden dome chosen for its deep history and religious value
"A major Islamic site mentioned in the Quran and Sunnah, chosen because of its great significance.",Morning,a major islamic site mentioned in the quran and sunnah chosen because of its great significance
"A beautiful example of Islamic Andalusian architecture, chosen for its rich history and stunning design.",Afternoon,a beautiful example of islamic andalusian architecture chosen for its rich history and stunning design
"A natural place with mountains and lakes, chosen because it feels calm and refreshing.",Afternoon,a natural place with mountains and lakes chosen because it feels calm and refreshing
"A powerful and huge waterfall, chosen because I read many exciting stories about it",Evening,a powerful and huge waterfall chosen because i read many exciting stories about it
"A peaceful mountain area with green valleys, chosen because it gives a relaxing feeling.",Afternoon,a peaceful mountain area with green valleys chosen because it gives a relaxing feeling
"A clear night sky full of stars, chosen because it creates a calm and peaceful mood",Evening,a clear night sky full of stars chosen because it creates a calm and peaceful mood
"A beutiful city with very great people living it, this image is before the genocide had been commited by the israeli occupation.",Evening,a beutiful city with very great people living it this image is before the genocide had been commited by the israeli occupation
"A beutiful city with very great people living it, this image is before the genocide had been commited by the israeli occupation.",Evening,a beutiful city with very great people living it this image is before the genocide had been commited by the israeli occupation
"This image captures a beautiful sunset over the Raouche Rocks in Beirut, Lebanon. I chose this place because I’ve visited it before, and the golden light reflecting on the Mediterranean Sea makes it one of the most peaceful and memorable views I’ve experienced.",Evening,this image captures a beautiful sunset over the raouche rocks in beirut lebanon i chose this place because i’ve visited it before and the golden light reflecting on the mediterranean sea makes it one of the most peaceful and memorable views i’ve experienced
"A dramatic silhouette of a mountain against a clear daytime sky, where the dark mountain ridge contrasts sharply with the bright sky. I chose this image because it captures the raw, powerful beauty of nature in a minimalistic way, and evokes a sense of peace and wonder.",Evening,a dramatic silhouette of a mountain against a clear daytime sky where the dark mountain ridge contrasts sharply with the bright sky i chose this image because it captures the raw powerful beauty of nature in a minimalistic way and evokes a sense of peace and wonder
"This image shows the calm, bright-blue waters of the Dead Sea in Jericho, Palestine. I chose this place because I have visited it, and the unique landscapes creates a peaceful and unforgettable atmosphere. The scene captures the natural beauty and serenity that make the Dead Sea one of the most remarkable spots in the region.",Afternoon,this image shows the calm brightblue waters of the dead sea in jericho palestine i chose this place because i have visited it and the unique landscapes creates a peaceful and unforgettable atmosphere the scene captures the natural beauty and serenity that make the dead sea one of the most remarkable spots in the region
"A captivating aerial view of the Alhambra Palace in Granada, showcasing its iconic red sandstone fortress walls, intricate Nasrid palaces with arabesque designs, lush terraced gardens of the Generalife, and the surrounding Sierra Nevada mountains under a clear blue sky. I chose this place because it's a masterpiece of Islamic architecture and history a UNESCO World Heritage site that blends Moorish elegance with stunning natural vistas, evoking centuries of royal splendor.",Afternoon,a captivating aerial view of the alhambra palace in granada showcasing its iconic red sandstone fortress walls intricate nasrid palaces with arabesque designs lush terraced gardens of the generalife and the surrounding sierra nevada mountains under a clear blue sky i chose this place because its a masterpiece of islamic architecture and history a unesco world heritage site that blends moorish elegance with stunning natural vistas evoking centuries of royal splendor
"Camp Nou, the iconic home stadium of FC Barcelona, captured in July 2024. lush green pitch under bright lights, and surrounding urban energy of Barcelona. I chose this place because it's the pulsating heart of Catalan football passion—where legends like Messi played, and now reborn as a state-of-the-art venue blending history with modern spectacle.",Afternoon,camp nou the iconic home stadium of fc barcelona captured in july lush green pitch under bright lights and surrounding urban energy of barcelona i chose this place because its the pulsating heart of catalan football passion—where legends like messi played and now reborn as a stateoftheart venue blending history with modern spectacle
"A majestic winter view of the Moscow Kremlin from across the frozen Moskva River, with its red-brick walls, golden-domed cathedrals, and the iconic Spasskaya Tower glowing under a light snowfall.",Evening,a majestic winter view of the moscow kremlin from across the frozen moskva river with its redbrick walls goldendomed cathedrals and the iconic spasskaya tower glowing under a light snowfall
"Charles Bridge in Prague during golden autumn, with the historic statues and arches glowing under warm sunlight, colorful trees lining the Vltava River, and Prague Castle rising in the misty background. I chose this place because it’s one of the most beautiful and romantic city views in Europe pure fairy-tale magic in fall colors.",Afternoon,charles bridge in prague during golden autumn with the historic statues and arches glowing under warm sunlight colorful trees lining the vltava river and prague castle rising in the misty background i chose this place because it’s one of the most beautiful and romantic city views in europe pure fairytale magic in fall colors
"A dramatic close-up of the monumental ""The Motherland Calls"" statue in Volgograd, her colossal concrete figure dramatically reaching skyward with a sword aloft, flowing robes billowing in the wind, set against a vivid blue sky and lush green hillside with a solitary visitor at her base. I chose this place because it's an awe-inspiring symbol of resilience and wartime heroism—a 52-meter-tall call to courage that stands as one of the world's most emotionally charged memorials.",Afternoon,a dramatic closeup of the monumental the motherland calls statue in volgograd her colossal concrete figure dramatically reaching skyward with a sword aloft flowing robes billowing in the wind set against a vivid blue sky and lush green hillside with a solitary visitor at her base i chose this place because its an aweinspiring symbol of resilience and wartime heroism—a metertall call to courage that stands as one of the worlds most emotionally charged memorials
"Underwater scuba diver swimming in the Red Sea of Aqaba with an exotic sea animal and beautiful coral reefs beneath them. The Red Sea is known for its colorful coral reefs and vibrant, diverse sea life.",Morning,underwater scuba diver swimming in the red sea of aqaba with an exotic sea animal and beautiful coral reefs beneath them the red sea is known for its colorful coral reefs and vibrant diverse sea life
Northern lights glowing above Iceland’s Kirkjufell mountain. People travel to the north pole from all around the world just to see these magical auroras.,Evening,northern lights glowing above iceland’s kirkjufell mountain people travel to the north pole from all around the world just to see these magical auroras
Crystal-clear water and limestone cliffs of Koh Phi Phi. I want to visit it for its beautiful nature and relaxing tropical vibes.,Afternoon,crystalclear water and limestone cliffs of koh phi phi i want to visit it for its beautiful nature and relaxing tropical vibes
Cyclists riding along Amsterdam’s canals. I chose Amsterdam beacause I love its vibrant cultural and artistic scene.,Morning,cyclists riding along amsterdam’s canals i chose amsterdam beacause i love its vibrant cultural and artistic scene
Dense green Amazon rainforest during sunrise. I would love to go to a meditation retreat there to experience the deep spiritual journey of connecting with nature.,Morning,dense green amazon rainforest during sunrise i would love to go to a meditation retreat there to experience the deep spiritual journey of connecting with nature
A quiet camping spot in Dahab’s desert mountains. I chose it because it feels peaceful and grounding.,Evening,a quiet camping spot in dahab’s desert mountains i chose it because it feels peaceful and grounding
New York’s skyline at night. I chose it for its energy and vibrant city life.,Evening,new york’s skyline at night i chose it for its energy and vibrant city life
"Colorful cliffside towns of Italy’s southern Amalfi coast. I chose it because it captures the essense of the warm, rich mediterranean culture.",Afternoon,colorful cliffside towns of italy’s southern amalfi coast i chose it because it captures the essense of the warm rich mediterranean culture
"Bloukrans Bridge, a famous bungee jumping spot in South Africa. I chose it for the thrill and dramatic scenery.",Afternoon,bloukrans bridge a famous bungee jumping spot in south africa i chose it for the thrill and dramatic scenery
Barcelona’s Sagrada Familia under soft daylight. I would like to visit it because the architecture is very creative and inspiring and the city overall feels very energetic.,Afternoon,barcelona’s sagrada familia under soft daylight i would like to visit it because the architecture is very creative and inspiring and the city overall feels very energetic
Cyclists riding along Amsterdam’s canals. I chose Amsterdam because I love its vibrant cultural and artistic scene.,Morning,cyclists riding along amsterdam’s canals i chose amsterdam because i love its vibrant cultural and artistic scene
A quiet camping spot in Dahab’s desert mountains. I chose it because it feels peaceful and grounding.,Evening,a quiet camping spot in dahab’s desert mountains i chose it because it feels peaceful and grounding
New York’s skyline at night. I chose it for its energy and vibrant city life.,Evening,new york’s skyline at night i chose it for its energy and vibrant city life
"Colorful cliffside towns of Italy’s southern Amalfi coast. I chose it because it captures the essence of the warm, rich Mediterranean culture.",Afternoon,colorful cliffside towns of italy’s southern amalfi coast i chose it because it captures the essence of the warm rich mediterranean culture
"place like heaven, fresh air, and a nice view",Afternoon,place like heaven fresh air and a nice view
intersting city,Evening,intersting city
I love modern cities,Evening,i love modern cities
quit place amd nice views,Afternoon,quit place amd nice views
i love to discover islamic contries and their hestory,Afternoon,i love to discover islamic contries and their hestory
I like to explore more about new cultures,Afternoon,i like to explore more about new cultures
ts atmosphere feels exciting and full of life,Afternoon,ts atmosphere feels exciting and full of life
A magical winter view of Northern Lights. I chose this place because I dream of seeing the aurora in real life,Evening,a magical winter view of northern lights i chose this place because i dream of seeing the aurora in real life
A beautiful historical view from Uzbekistan with traditional Islamic architecture. I chose this place because I love exploring ancient cities and their culture,Afternoon,a beautiful historical view from uzbekistan with traditional islamic architecture i chose this place because i love exploring ancient cities and their culture
historic buildings classical music and elegant streets,Evening,historic buildings classical music and elegant streets
stunning sea views and romantic sunsets,Evening,stunning sea views and romantic sunsets
beautiful country,Afternoon,beautiful country
city of canals bridges and timeless charm,Evening,city of canals bridges and timeless charm
famous landmarks historic streets,Evening,famous landmarks historic streets
clear beaches and nature,Evening,clear beaches and nature
vacation and beaches,Morning,vacation and beaches
tropical paradise with crystal-clear water,Morning,tropical paradise with crystalclear water
old bridges colorful buildings,Evening,old bridges colorful buildings
A stunning view of Chureito Pagoda against Mount Fuji during a clear spring evening.,Evening,a stunning view of chureito pagoda against mount fuji during a clear spring evening
A romantic evening view of the Eiffel Tower glowing beside the Seine River.,Evening,a romantic evening view of the eiffel tower glowing beside the seine river
A misty morning view of the Great Wall of China winding across mountains.,Morning,a misty morning view of the great wall of china winding across mountains
A bright afternoon scene of Marina Bay Sands with Singapore's modern skyline.,Afternoon,a bright afternoon scene of marina bay sands with singapores modern skyline
A sunny afternoon view of the Leaning Tower of Pisa with visitors relaxing nearby.,Afternoon,a sunny afternoon view of the leaning tower of pisa with visitors relaxing nearby
A breathtaking sunset view of the Pyramids of Giza surrounded by desert.,Evening,a breathtaking sunset view of the pyramids of giza surrounded by desert
A sunset view of a historic Spanish hilltop city by a river gorge.,Evening,a sunset view of a historic spanish hilltop city by a river gorge
A morning aerial view of Christ the Redeemer overlooking Rio de Janeiro.,Morning,a morning aerial view of christ the redeemer overlooking rio de janeiro
A sunny fall afternoon view of Big Ben and the Houses of Parliament in London.,Afternoon,a sunny fall afternoon view of big ben and the houses of parliament in london
Traditional Dutch windmills beside a calm river under a sunny sky.,Afternoon,traditional dutch windmills beside a calm river under a sunny sky
"The historic old town of Tbilisi glows warmly at sunset, with colorful traditional houses cascading down the hillside and the ancient Narikala Fortress perched above. This charming scene showcases Georgia's unique architecture and rich cultural heritage.",Evening,the historic old town of tbilisi glows warmly at sunset with colorful traditional houses cascading down the hillside and the ancient narikala fortress perched above this charming scene showcases georgias unique architecture and rich cultural heritage
"A picturesque Swiss Alpine village with traditional wooden chalets, a crystal-clear stream, and vibrant flower gardens set against dramatic mountain peaks. This idyllic scene captures the natural beauty and charm that make Switzerland a dream destination.",Morning,a picturesque swiss alpine village with traditional wooden chalets a crystalclear stream and vibrant flower gardens set against dramatic mountain peaks this idyllic scene captures the natural beauty and charm that make switzerland a dream destination
The iconic white-washed village of Santorini glows warmly as sunset paints the sky in stunning shades of purple and gold over the Aegean Sea. The famous blue-domed churches and clifftop buildings create one of the world's most romantic and breathtaking views.,Evening,the iconic whitewashed village of santorini glows warmly as sunset paints the sky in stunning shades of purple and gold over the aegean sea the famous bluedomed churches and clifftop buildings create one of the worlds most romantic and breathtaking views
The colorful coastal village of Vernazza in Cinque Terre features vibrant buildings cascading down to a turquoise harbor filled with traditional fishing boats. This UNESCO World Heritage site perfectly captures the charm and beauty of the Italian Riviera.,Afternoon,the colorful coastal village of vernazza in cinque terre features vibrant buildings cascading down to a turquoise harbor filled with traditional fishing boats this unesco world heritage site perfectly captures the charm and beauty of the italian riviera
"Singapore's futuristic skyline illuminates at dusk, showcasing sleek skyscrapers and modern architecture along the waterfront. This dynamic cityscape highlights Singapore's position as a leading global financial hub and one of Asia's most innovative cities.",Evening,singapores futuristic skyline illuminates at dusk showcasing sleek skyscrapers and modern architecture along the waterfront this dynamic cityscape highlights singapores position as a leading global financial hub and one of asias most innovative cities
Stockholm's Gamla Stan (Old Town) showcases colorful historic buildings and the distinctive green spire of the German Church under a bright blue sky. This charming medieval quarter is one of Europe's best-preserved old towns and the heart of Swedish history.,Afternoon,stockholms gamla stan old town showcases colorful historic buildings and the distinctive green spire of the german church under a bright blue sky this charming medieval quarter is one of europes bestpreserved old towns and the heart of swedish history
"London's iconic skyline glows at twilight, featuring the illuminated Houses of Parliament, Big Ben, and modern bridges spanning the Thames River. This stunning view captures the perfect blend of historic grandeur and contemporary architecture that defines Britain's capital.",Evening,londons iconic skyline glows at twilight featuring the illuminated houses of parliament big ben and modern bridges spanning the thames river this stunning view captures the perfect blend of historic grandeur and contemporary architecture that defines britains capital
Kuala Lumpur's spectacular skyline at dusk features the iconic Petronas Twin Towers illuminated against a vibrant blue and orange sky. This modern metropolis showcases Malaysia's rapid development and its status as a major Southeast Asian destination.,Evening,kuala lumpurs spectacular skyline at dusk features the iconic petronas twin towers illuminated against a vibrant blue and orange sky this modern metropolis showcases malaysias rapid development and its status as a major southeast asian destination
Dozens of colorful hot air balloons float over Cappadocia's unique fairy chimney rock formations at sunrise. This magical landscape in central Turkey offers one of the world's most unforgettable ballooning experiences above ancient volcanic valleys.,Morning,dozens of colorful hot air balloons float over cappadocias unique fairy chimney rock formations at sunrise this magical landscape in central turkey offers one of the worlds most unforgettable ballooning experiences above ancient volcanic valleys
"""Stunning Dome of the Rock view. I chose this place because I visited it when I was young.""",Afternoon,stunning dome of the rock view i chose this place because i visited it when i was young
